NC,sentence_nat_1,tag_sentence_nat_1,sentence_nat_2,tag_sentence_nat_2,sentence_nat_3,tag_sentence_nat_3,comp_score,gold_syn_1,gold_syn_2,gold_syn_3,sentence_neut,tag_sentence_neut,word_1,word_x,word_2,wordsyn
frutto proibito,""" è abbastanza interessante notare che la stessa struttura di stretta opposizione fosse presente nel giardino di Eden , "" Il frutto proibito contrapposto all ' albero della vita , l ' uno dolce , l ' altro amaro .","[False, False, False, False, False, False, False, False, False, False, False, False, False, False, False, False, False, False, False, False, False, True, True, False, False, False, False, False, False, False, False, False, False, False, False, False, False, False, False, False]","Ora vediamo che Adamo cadde in fallo , per aver preso del frutto proibito secondo la parola di Dio ; e così vediamo che , a causa della sua caduta , tutto il genere umano divenne un popolo perduto e decaduto .","[False, False, False, False, False, False, False, False, False, False, False, False, True, True, False, False, False, False, False, False, False, False, False, False, False, False, False, False, False, False, False, False, False, False, False, False, False, False, False, False, False, False]","Finché dura , l ' innovatore affonda la spada del profitto nella carne del mercato e gode del frutto proibito di un profitto monopolistico .","[False, False, False, False, False, False, False, False, False, False, False, False, False, False, False, False, False, False, True, True, False, False, False, False, False]",,tentazione,cosa vietata,peccato,Questo è un frutto proibito.,"[False, False, False, True, True]",prodotto,,vietato,prodotto vietato
sanità pubblica,E' innegabile che la sanità pubblica e privata viva una crisi assistenziale ed occupazionale senza precedenti.,"[False, False, False, False, True, True, False, False, False, False, False, False, False, False, False, False]",Non vi è consenso tra gli esperti di sanità pubblica sul livello di dipendenza dal khat.,"[False, False, False, False, False, False, False, False, True, True, False, False, False, False, False, False]",Questo diritto potrà essere davvero garantito da una sanità pubblica che nel periodo 2012-2015 dovrà rinunciare a oltre 25 miliardi di euro?,"[False, False, False, False, False, False, False, False, True, True, False, False, False, False, False, False, False, False, False, False, False, False]",,sistema sanitario nazionale,assistenza sanitaria pubblica,igiene pubblica,Questa è una sanità pubblica.,"[False, False, False, True, True]",salute,,statale,salute statale
botte da orbi,"Nella società attuale la scuola è rimasta l ' unico luogo d ' incontro di tutti , dopo basterà il tifo per la squadra di calcio e saranno botte da orbi .","[False, False, False, False, False, False, False, False, False, False, False, False, False, False, False, False, False, False, False, False, False, False, False, False, False, False, False, False, True, True, True, False]",""" Vedo una specie di guerra di Troia : dieci anni di aggressioni reciproche e sono ancora tutti lì a menarsi botte da orbi , tutti i giorni , alla ricerca di visibilità e di potere .","[False, False, False, False, False, False, False, False, False, False, False, False, False, False, False, False, False, False, False, False, False, True, True, True, False, False, False, False, False, False, False, False, False, False, False, False, False]",""" Poi , quando sono arrivati i soldi , i ragazzi hanno potuto fare sul serio , di qua i buoni di là i cattivi , e giù botte da orbi .","[False, False, False, False, False, False, False, False, False, False, False, False, False, False, False, False, False, False, False, False, False, False, False, False, False, False, False, False, True, True, True, False]",,percosse violente,pestaggio,lotta furibonda,Queste sono botte da orbi.,"[False, False, True, True, True]",percosse,da,ciechi,percosse da ciechi
amor proprio,"Il suo futuro ora è senza futuro per mancanza di coraggio, assenza di visione strategica ed abbondanza di amor proprio , peraltro, molto male tutelato.","[False, False, False, False, False, False, False, False, False, False, False, False, False, False, False, False, False, False, True, True, False, False, False, False, False]","Se invece non lo sapevate, perché non avete avuto il coraggio di dimettervi, dimostrandovi più attaccati alle vostre poltrone che al vostro amor proprio ?","[False, False, False, False, False, False, False, False, False, False, False, False, False, False, False, False, False, False, False, False, False, False, True, True, False]","Convinci un uomo che è un animale, che la sua dignità e il suo amor proprio sono illusioni, che non c'è nessun ""aldilà"" a cui aspirare, che non esiste un potenziale più elevato da raggiungere, e avrai uno schiavo.","[False, False, False, False, False, False, False, False, False, False, False, False, False, False, True, True, False, False, False, False, False, False, False, False, False, False, False, False, False, False, False, False, False, False, False, False, False, False, False]",,dignità,autostima,orgoglio personale,Questo è un amor proprio.,"[False, False, False, True, True]",affetto,,personale,affetto personale
fecondazione assistita,L'indiscutibile e da molti imprevisto successo della Chiesa nei referendum riguardanti la fecondazione assistita nel 2005 ne è una prova concreta.,"[False, False, False, False, False, False, False, False, False, False, False, False, True, True, False, False, False, False, False, False, False]","La conta dei follicoli, ad oggi, è uno degli strumenti più efficaci per stimare la riserva ovarica femminile e per verificare la possibilità di ottenere una gravidanza con fecondazione assistita .","[False, False, False, False, False, False, False, False, False, False, False, False, False, False, False, False, False, False, False, False, False, False, False, False, False, False, False, False, True, True, False]","Le leggi europee in materia di fecondazione assistita sono simili nell'impianto e nei criteri di fondo, ma si differenziano per gli obiettivi e le possibilità che consentono.","[False, False, False, False, False, False, True, True, False, False, False, False, False, False, False, False, False, False, False, False, False, False, False, False, False, False, False]",,procreazione medicalmente assistita,riproduzione assistita,inseminazione artificiale,Questa è una fecondazione assistita.,"[False, False, False, True, True]",concepimento,,aiutato,concepimento aiutato
uccel di bosco,"A quel punto sarà chiaro che Rebaudengo si sentiva già osservato dalla legge e voleva rendersi uccel di bosco , andandosi a godere le sue sostanze presso i Borboni , dove forse aveva già inviato il suo denaro .","[False, False, False, False, False, False, False, False, False, False, False, False, False, False, False, False, True, True, True, False, False, False, False, False, False, False, False, False, False, False, False, False, False, False, False, False, False, False, False]","Avrete compreso che di qui all ' imbarco sarete seguito passo per passo , ma vi chiederete come mai non temiamo che dopo , alla prima sosta , non siate tentato di rendervi uccel di bosco .","[False, False, False, False, False, False, False, False, False, False, False, False, False, False, False, False, False, False, False, False, False, False, False, False, False, False, False, False, False, False, False, False, False, True, True, True, False]","Adesso però , con Dodson uccel di bosco e tu che sei andato a ficcanasare da quelle parti , loro sanno che noi sappiamo , e il nostro margine di manovra va restringendosi a vista d ' occhio .","[False, False, False, False, False, True, True, True, False, False, False, False, False, False, False, False, False, False, False, False, False, False, False, False, False, False, False, False, False, False, False, False, False, False, False, False, False, False, False]",,latitante,introvabile,fuggitivo,Questo è un uccel di bosco.,"[False, False, False, True, True, True]",pennuto,di,selva,pennuto di selva
stile libero,"Anche il nuoto è uno sport completo che fa benissimo a tutti i muscoli del corpo: potete puntare sullo stile libero , il dorso oppure la rana perché ognuno di questi movimenti vi aiuterà a ridurre il grasso sulle ginocchia.","[False, False, False, False, False, False, False, False, False, False, False, False, False, False, False, False, False, False, False, True, True, False, False, False, False, False, False, False, False, False, False, False, False, False, False, False, False, False, False, False]","Per questo la Piscina Comunale di Forlì sarà occupata sin dalla prima mattina e incessantemente per l'intera giornata, con lo svolgimento degli stili farfalla e dorso prima di pranzo, mentre la rana e lo stile libero si svolgeranno nel pomeriggio.","[False, False, False, False, False, False, False, False, False, False, False, False, False, False, False, False, False, False, False, False, False, False, False, False, False, False, False, False, False, False, False, False, False, False, True, True, False, False, False, False]","Mack Horton, in progresso , vince i 1500 stile libero .","[False, False, False, False, False, False, False, False, True, True, False]",,crawl anteriore,stile frontale,nuoto frontale,Questo è uno stile libero.,"[False, False, False, True, True]",maniera,,sciolta,maniera sciolta
figlio di papà,"Con qualche sacrificio economico ( lavoro da quando avevo 17 anni e comunque non sono figlio di papà ) comprai , guarda un pò , un ' altra UNO T .","[False, False, False, False, False, False, False, False, False, False, False, False, False, False, False, True, True, True, False, False, False, False, False, False, False, False, False, False, False, False, False]",Steve ( il figlio di papà ) dovrà partire la mattina seguente per il college in una città dell ' Est .,"[False, False, False, True, True, True, False, False, False, False, False, False, False, False, False, False, False, False, False, False, False, False]","Si chiamava , l ' ho saputo dopo , Settimio Passetti , un figlio di papà , non aveva neanche vent ' anni .","[False, False, False, False, False, False, False, False, False, False, False, False, False, True, True, True, False, False, False, False, False, False, False, False]",,giovane privilegiato,rampollo viziato,erede ricco,Questo è un figlio di papà.,"[False, False, False, True, True, True]",prole,di,padre,prole di padre
pelo nell'uovo,"Si dirà che il vantaggio acquisito con l ' approvazione della legge ha riguardato tutte le aziende che erano nelle condizioni di Mediaset , e che si cerca sempre il pelo nell ' uovo per attaccare il Cavaliere .","[False, False, False, False, False, False, False, False, False, False, False, False, False, False, False, False, False, False, False, False, False, False, False, False, False, False, False, False, False, False, True, False, False, True, False, False, False, False, False]","Eppure il pesarese è riuscito a trovare il pelo nell ' uovo : "" È andata abbastanza bene , però non sono riuscito a ripetere il tempo di questa mattina quando ero stato più veloce .","[False, False, False, False, False, False, False, False, True, False, False, True, False, False, False, False, False, False, False, False, False, False, False, False, False, False, False, False, False, False, False, False, False, False, False, False]",I critici che cercano il pelo nell ' uovo e non capiscono che tu sei inserito nei gusti della gente .,"[False, False, False, False, False, True, False, False, True, False, False, False, False, False, False, False, False, False, False, False, False]",,pignoleria,eccesso di zelo,minuzia,Questo è un pelo nell'uovo.,"[False, False, False, True, True]",filamento,nell',ovulo,peluria nell' ovulo
governo federale,"Una ricerca del governo federale , divulgata a novembre, rivela che sarebbero esclusi dall'accesso alla scuola circa 2,7 milioni di bambini tra i 7 ed i 14 anni.","[False, False, False, True, True, False, False, False, False, False, False, False, False, False, False, False, False, False, False, False, False, False, False, False, False, False, False, False]","E quando le loro forze e i loro alleati si scontrano, il saldo e' monumentale, obbligando il governo federale ad intervenire con i soldati.","[False, False, False, False, False, False, False, False, False, False, False, False, False, False, False, False, False, True, True, False, False, False, False, False]","Il governo federale , cui competono la politica estera, la difesa, la programmazione e l'amministrazione dei settori nazionalizzati dell'economia, è responsabile nei confronti del Parlamento, cui spetta l'esercizio del potere legislativo.","[False, True, True, False, False, False, False, False, False, False, False, False, False, False, False, False, False, False, False, False, False, False, False, False, False, False, False, False, False, False, False]",,esecutivo centrale,autorità della federazione,amministrazione centrale,Questo è un governo federale.,"[False, False, False, True, True]",amministrazione,,unita,amministrazione unita
acqua minerale,"Il consumatore ritiene che queste denominazioni siano sinonimi, con l'eccezione per l' acqua minerale che puo' avere particolari sapori e perche' venduta in bottiglia.","[False, False, False, False, False, False, False, False, False, False, False, False, True, True, False, False, False, False, False, False, False, False, False, False]","L' acqua minerale viene trasportata da Bolzano a Palermo e viceversa, con un inquinamento pazzesco, econ scarsa qualità, senza contare poi i milioni di bottiglie di plastica che vengono gettate ogni giorno alla spazzatura!","[False, True, True, False, False, False, False, False, False, False, False, False, False, False, False, False, False, False, False, False, False, False, False, False, False, False, False, False, False, False, False, False, False, False]","Un servizio che ha consentito una riduzione dei costi per le famiglie, abituate ad acquistare acqua minerale nei supermercati, e nel quantitativo di plastica da raccogliere e smaltire.","[False, False, False, False, False, False, False, False, False, False, False, False, False, False, False, True, True, False, False, False, False, False, False, False, False, False, False, False]",,bevanda in bottiglia,acqua di fonte,acqua naturale,Questa è una acqua minerale.,"[False, False, False, True, True]",liquido,,naturale,liquido naturale
lingua madre,"Il nome deriva però dalla sua lingua madre , l'etrusco.","[False, False, False, False, False, False, True, True, False, False]","Il piano studi comprende attività linguistico-formative finalizzate al consolidamento della lingua madre e nelle altre lingue di studio, all'interno del sito web troverete tutte le relative informazioni.","[False, False, False, False, False, False, False, False, False, False, True, True, False, False, False, False, False, False, False, False, False, False, False, False, False, False, False]","Ogni Paese ha raccolto e selezionato alcune ricette tradizionali, e una volta trascritte, sia in lingua madre che in inglese, le ha inviate a Roma.","[False, False, False, False, False, False, False, False, False, False, False, False, False, False, False, True, True, False, False, False, False, False, False, False, False]",,madrelingua,idioma natio,prima lingua,Questa è una lingua madre.,"[False, False, False, True, True]",idioma,,genitrice,idioma genitrice
olio di gomito,"Alla fine ci vorrebbe dell ' olio di gomito ( non chiedetemi dove si procura ... ) , con questo riuscirete a lucidare il mobiletto tanto da farlo splendere !","[False, False, False, False, False, False, True, True, True, False, False, False, False, False, False, False, False, False, False, False, False, False, False, False, False, False, False, False, False, False]","Come unico detersivo la liscivia ( cenere e acqua bollente in proporzione ) , come strumento di lavoro una spazzola di saggina e tanto "" olio di gomito "" ovvero fatica allo sfinimento al lavatoio che comunque rappresentava un progresso rispetto_allo stare chinate sulla riva di un fossato .","[False, False, False, False, False, False, False, False, False, False, False, False, False, False, False, False, False, False, False, False, False, False, False, False, False, True, True, True, False, False, False, False, False, False, False, False, False, False, False, False, False, False, False, False, False, False, False, False, False]","Voi vi rendete conto che ci vorrebbe serietà , olio di gomito , una politica che studia i problemi in_base_ai dati scientifici e non in_base_alle frottole e soprattutto che non si affida ai marziani .","[False, False, False, False, False, False, False, False, False, True, True, True, False, False, False, False, False, False, False, False, False, False, False, False, False, False, False, False, False, False, False, False, False, False, False]",,lavoro manuale pesante,impegno fisico,lavoro manuale ripetitivo,Questo è un olio di gomito.,"[False, False, False, True, True, True]",grasso,di,articolazione,grasso di articolazione
guardia forestale,"Sebbene alcuni dettagli debbano essere ancora definiti, ulteriori ammende saranno rilasciate ai perpetratori anche da parte dei ministeri delle finanze, dell'ambiente, e dalla guardia forestale","[False, False, False, False, False, False, False, False, False, False, False, False, False, False, False, False, False, False, False, False, False, False, False, True, True]",Pensate che è protetto dalla guardia forestale.,"[False, False, False, False, False, True, True]","Chiamò poi, con il cellulare, un amico del padre, guardia forestale , chiedendogli aiuto.","[False, False, False, False, False, False, False, False, False, True, True, False, False, False]",,corpo forestale,agenti dei boschi,guardiaboschi,Questa è una guardia forestale.,"[False, False, False, True, True]",sorvegliante,,boschivo,sorvegliante boschivo
doccia scozzese,"Spesso poi avanza effettivamente dell ' acqua calda a chi ha inserito una palata di gettoni per paura della doccia scozzese , non è quindi raro farsi una bella doccia calda a sbafo .","[False, False, False, False, False, False, False, False, False, False, False, False, False, False, False, False, False, False, False, True, True, False, False, False, False, False, False, False, False, False, False, False, False, False]","Una doccia scozzese che ha funzionato per la crescita , meno - dice Bernanke - per i conti pubblici .","[False, True, True, False, False, False, False, False, False, False, False, False, False, False, False, False, False, False, False, False]",""" La doccia scozzese facilita l ' afflusso del sangue al cervello e quindi giova ai cretini come te "" diceva .","[False, False, True, True, False, False, False, False, False, False, False, False, False, False, False, False, False, False, False, False, False, False]",,sbalzo termico,shock,successione di fatti contrastanti,Questa è una doccia scozzese.,"[False, False, False, True, True]",lavaggio,,britannico,lavaggio britannico
sepolcri imbiancati,"Bravo padre , continui così contro i sepolcri imbiancati del Duemila e i fautori del falso perbenismo di facciata .","[False, False, False, False, False, False, False, True, True, False, False, False, False, False, False, False, False, False, False, False]","I lavoratori veri , e non le fittizie rappresentazioni con i sepolcri imbiancati che ancora oggi siedono al tavolo di contrattazione , hanno dimostrato di saper dire la loro e rendersi autorevolmente VISIBILI !","[False, False, False, False, False, False, False, False, False, False, False, True, True, False, False, False, False, False, False, False, False, False, False, False, False, False, False, False, False, False, False, False, False, False]","Con tutti i problemi che ha il Paese questi sepolcri imbiancati , divorziati , finocchi con il c .. o degli altri ci impongono da mesi una discussione sui Dico .","[False, False, False, False, False, False, False, False, False, True, True, False, False, False, False, False, False, False, False, False, False, False, False, False, False, False, False, False, False, False, False]",,ipocriti,persone false,finti onesti,Questi sono sepolcri imbiancati.,"[False, False, True, True]",tombe,,verniciate,tombe verniciate
minestra riscaldata,"Non perché sia una minestra riscaldata ( Berlusconi lo è molto di più ) , né perché lo danneggino gli scandaletti montati contro di lui , bensì per la non esaltante performance alla testa dell ' Ue .","[False, False, False, False, True, True, False, False, False, False, False, False, False, False, False, False, False, False, False, False, False, False, False, False, False, False, False, False, False, False, False, False, False, False, False, False, False, False]","Ma il puzzle non era completo , e questo Marcello Lippi - il figliol prodigo o la minestra riscaldata , a seconda dei critici - lo sapeva benissimo .","[False, False, False, False, False, False, False, False, False, False, False, False, False, False, False, False, False, True, True, False, False, False, False, False, False, False, False, False, False]","E ha dimostrato anche un ' altra cosa : che la minestra riscaldata , quando è toscana , è buonissima .","[False, False, False, False, False, False, False, False, False, False, False, True, True, False, False, False, False, False, False, False, False]",,situazione passata riproposta,riproposizione,banalità,Questa è una minestra riscaldata.,"[False, False, False, True, True]",zuppa,,tiepida,zuppa tiepida
tempo reale,"Chiunque puo' inviare un suo articolo, che apparira' in tempo reale sul portale.","[False, False, False, False, False, False, False, False, False, True, True, False, False]",Le posizioni di tutti questi conti possono essere visualizzate in tempo reale .,"[False, False, False, False, False, False, False, False, False, False, True, True, False]",Tra qualche settimana sarà quindi possibile commentare una notizia o discuterne in tempo reale con altri utenti.,"[False, False, False, False, False, False, False, False, False, False, False, False, True, True, False, False, False]",,Contemporaneo,istantaneo,concomitante,Questo è un tempo reale.,"[False, False, False, True, True]",epoca,,effettivo,momento effettivo
cassa automatica,Le casse automatiche sono già state aggiornate con le nuove tariffe.,"[False, True, True, False, False, False, False, False, False, False, False]","Il pagamento si effettua presso le casse automatiche situate all'interno del parcheggio, solo in contanti.","[False, False, False, False, False, False, True, True, False, False, False, False, False, False, False]","Presso gli uffici di via Ostiense 131/L si potrà pagare anche con il bancomat, utilizzando le casse automatiche , senza pagare commissioni.","[False, False, False, False, False, False, False, False, False, False, False, False, False, False, False, False, True, True, False, False, False, False]",,macchinette,pagamento automatico,terminali di vendita,Questa è una cassa automatica.,"[False, False, False, True, True]",terminale,,meccanico,terminale meccanico
disco rigido,"I cookie poi si distinguono in ""di sessione"" e ""persistenti"", i primi una volta scaricati vengono poi eliminati alla chiusura del Browser, i secondi invece vengono memorizzati sul disco rigido dell'utente/visitatore fino alla loro scadenza.","[False, False, False, False, False, False, False, False, False, False, False, False, False, False, False, False, False, False, False, False, False, False, False, False, False, False, False, False, True, True, False, False, False, False, False]","La procedura richiede di formattare il disco rigido e, di conseguenza, comporta la perdita di tutti i propri dati.","[False, False, False, False, False, False, True, True, False, False, False, False, False, False, False, False, False, False, False]",Se sul tuo disco rigido sono presenti dei files duplicati che ne riducono la capacità Easy Duplicate Finder te li mostrerà e ti permetterà di correre ai ripari.,"[False, False, False, True, True, False, False, False, False, False, False, False, False, False, False, False, False, False, False, False, False, False, False, False, False, False, False, False]",,hard disk,unità di memoria,disco fisso,Questo è un disco rigido.,"[False, False, False, True, True]",piatto,,duro,piatto duro
pesce piccolo,"A sua volta , in questo gioco in cui pesce grosso mangia pesce piccolo , Tci è stata comprata da mamma At & t .","[False, False, False, False, False, False, False, False, False, False, False, False, True, True, False, False, False, False, False, False, False, False, False, False, False]",Una succinta lettura della cartelletta mi confermò che avevo preso un pesce piccolo : era uno junkie di poco conto .,"[False, False, False, False, False, False, False, False, False, False, False, True, True, False, False, False, False, False, False, False, False]","Hejmo probabilmente era un « pesce piccolo » , ritiene l ' ex giudice , il cui nome sarebbe stato fatto circolare per coprire personaggi più in vista .","[False, False, False, False, False, True, True, False, False, False, False, False, False, False, False, False, False, False, False, False, False, False, False, False, False, False, False, False, False]",,figura irrilevante,persona poco influente,subalterno,Questo è un pesce piccolo.,"[False, False, False, True, True]",animale marino,,minuto,animale marino minuto
