NC,sentence_nat_1,tag_sentence_nat_1,sentence_nat_2,tag_sentence_nat_2,sentence_nat_3,tag_sentence_nat_3,comp_score,gold_syn_1,gold_syn_2,gold_syn_3,sentence_neut,tag_sentence_neut,word_1,word_x,word_2,wordsyn
filo conduttore,"La musica era in effetti il filo conduttore della serata, condotta da Laura Padovani e Stefano Muroni per la direzione artistica di Made Eventi.","[False, False, False, False, False, False, True, True, False, False, False, False, False, False, False, False, False, False, False, False, False, False, False, False]","Con Maurizio Piscitelli, invece, il filo conduttore diventa l'immigrazione e l'analisi delle complessità che riguardano l'inserimento dei migranti in contesti didattici italiani.","[False, False, False, False, False, True, True, False, False, False, False, False, False, False, False, False, False, False, False, False, False, False]","Il filo conduttore della nostra uscita didattica sarà il lavoro artigianale, osservato dal punto di vista commerciale e socio-culturale, come parte integrante dello sviluppo economico della città.","[False, True, True, False, False, False, False, False, False, False, False, False, False, False, False, False, False, False, False, False, False, False, False, False, False, False, False]",,leitmotiv,tema portante,trama comune,Questo è un filo conduttore.,"[False, False, False, True, True]",spago,,trasmettitore,spago trasmettitore
zoccolo duro,"E ' necessario costruire uno zoccolo duro di ricerca ( senza nessun aggettivo che la qualifichi ) per poter elevare dei "" monumenti "" particolari dedicati a specifiche operazioni finalizzate .","[False, False, False, False, False, True, True, False, False, False, False, False, False, False, False, False, False, False, False, False, False, False, False, False, False, False, False, False, False, False, False]","Adesso non posso più giocare a tennis con le morbide scarpe di Pirelli , né con lo zoccolo duro di Occhetto , sennò si rovina il campo .","[False, False, False, False, False, False, False, False, False, False, False, False, False, False, False, False, False, True, True, False, False, False, False, False, False, False, False, False]","E la tenerezza quasi pasoliniana per i giovani reietti , che costituivano lo zoccolo duro del suo pubblico , lo portò addirittura ad aprire la sua villa dell ' Olgiata a tossici , prostitute , ex - detenuti e punk borgatari di ogni genere .","[False, False, False, False, False, False, False, False, False, False, False, False, False, True, True, False, False, False, False, False, False, False, False, False, False, False, False, False, False, False, False, False, False, False, False, False, False, False, False, False, False, False, False, False, False]",,nucleo resistente,base solida,parte irriducibile,Questo è uno zoccolo duro.,"[False, False, False, True, True]",calzatura,,rigida,calzatura rigida
pelle d'oca,Ho la pelle d'oca sulle gambe e sulle braccia e l'acqua è troppo calda.,"[False, False, True, True, False, False, False, False, False, False, False, False, False, False]","A me in particolare sono piaciute le voci dei due protagonisti, mi facevano venire la pelle d'oca.","[False, False, False, False, False, False, False, False, False, False, False, False, False, False, False, True, True]","Intensa la prima parte con la morte di Creed, mi ha fatto venire la pelle d'oca .","[False, False, False, False, False, False, False, False, False, False, False, False, False, False, True, True, False]",,l'accapponarsi della pelle,brivido,cute anserina,Questa è una pelle d'oca.,"[False, False, False, True, True]",cute,di,pennuto,cute di pennuto
carta d'identità,"Con un folto gruppo di pr Microsoft entro in un pub, mi ordinano un bicchiere di vino; la barista mi chiede la carta d'identità .","[False, False, False, False, False, False, False, False, False, False, False, False, False, False, False, False, False, False, False, False, False, False, True, True, False]",Bastano la carta d'identità e un paio di ore libere.,"[False, False, True, True, False, False, False, False, False, False]",L'operatrice mi ha detto che stavano adeguando le tariffe elettriche e mi ha chiesto gli estremi della carta d'identità.,"[False, False, False, False, False, False, False, False, False, False, False, False, False, False, False, False, False, True, True]",,documento di riconoscimento,CIE,documento,Questa è una carta d'identità.,"[False, False, False, True, True]",tessera,d',individualità,tessera d’individualità
piazza pulita,Un libro felice e arguto che fa piazza pulita del preconcetto secondo il quale l ' architettura è qualcosa di astruso e teorico .,"[False, False, False, False, False, False, False, True, True, False, False, False, False, False, False, False, False, False, False, False, False, False, False, False]",Scoprirete e farete piazza pulita di falsi amici che per molti mesi vi hanno insidiato con maldicenze e pettegolezzi vari .,"[False, False, False, True, True, False, False, False, False, False, False, False, False, False, False, False, False, False, False, False, False]","Essa ci chiederà , per prima cosa , di fare piazza pulita di tutto quello che credevamo di sapere .","[False, False, False, False, False, False, False, False, False, False, True, True, False, False, False, False, False, False, False, False]",,eliminazione totale,svuotamento,sgombero completo,Questa è una piazza pulita.,"[False, False, False, True, True]",spiazzo,,lavato,spiazzo lavato
pesca a strascico,"Un altro tipo di pesca economicamente molto importante è la pesca a strascico d'altura, per la quale sono presenti imbarcazioni nel porto di Santa Margherita Ligure e Camogli.","[False, False, False, False, False, False, False, False, False, False, True, True, True, False, False, False, False, False, False, False, False, False, False, False, False, False, False, False]","Nelle catture della pesca a strascico le taglie sono in genere comprese tra 10 e 30 cm, mentre esemplari più grandi vengono catturati con palangari di profondità e reti da posta.","[False, False, False, True, True, True, False, False, False, False, False, False, False, False, False, False, False, False, False, False, False, False, False, False, False, False, False, False, False, False, False]","La pesca ai bianchetti non è assolutamente dannosa rispetto alla pesca a strascico , vero e proprio aratro dei fondali, semmai ci sono difficoltà di controlli e su questo bisognerebbe subito intervenire.","[False, False, False, False, False, False, False, False, False, False, True, True, True, False, False, False, False, False, False, False, False, False, False, False, False, False, False, False, False, False, False, False]",,pesca intensiva,pesca con reti,rastrellamento marino,Questa è una pesca a strascico.,"[False, False, False, True, True, True]",cattura,a,trascinamento,cattura a trascinamento
sabbia negli ingranaggi,Se non avesse ragione Tobin nel suggerire di gettare qualche manciata di sabbia negli ingranaggi di questo meccanismo travolgente ?,"[False, False, False, False, False, False, False, False, False, False, False, False, True, True, True, False, False, False, False, False]","Riuscendo perfino a mettere sabbia negli ingranaggi di un sistema istituzionale , quello della V Repubblica gollista , creato per evitare ogni stallo di potere .","[False, False, False, False, True, True, True, False, False, False, False, False, False, False, False, False, False, False, False, False, False, False, False, False, False, False]","Non per sciovinismo, non per un amor di patria che non ci appartiene affatto; ma per sovvertire questa logica di disgregazione sociale, per mettere sabbia negli ingranaggi della divisione internazionale del lavoro, per organizzarci collettivamente. ","[False, False, False, False, False, False, False, False, False, False, False, False, False, False, False, False, False, False, False, False, False, False, False, False, True, True, True, False, False, False, False, False, False, False, False]",,ostacolo al funzionamento,impedimento,intralcio,Questa è una sabbia negli ingranaggi.,"[False, False, False, True, True, True]",rena,nei,meccanismi,rena nei meccanismi
editto bulgaro,"La rivalutazione del conduttore - già oggetto del berlusconiano « editto bulgaro » , dopo il quale fu allontanato dalla tv - avviene in seguito alla trasmissione sui rifiuti in Campania , nella quale si è parlato anche delle responsabilità della sinistra .","[False, False, False, False, False, False, False, False, False, False, True, True, False, False, False, False, False, False, False, False, False, False, False, False, False, False, False, False, False, False, False, False, False, False, False, False, False, False, False, False, False, False, False]","Poi dal 2006 con il centro - sinistra allora ha scoperto il babao , è un po ' tardi , l ' editto Bulgaro è del 2002 !","[False, False, False, False, False, False, False, False, False, False, False, False, False, False, False, False, False, False, False, False, False, False, True, True, False, False, False, False]","Il precedente storico : nel 2002 l ' editto bulgaro quando Berlusconi accusò Luttazzi , Biagi e Santoro "" Lerner torna in Rai , e la controllerei io .... "" .","[False, False, False, False, False, False, False, False, True, True, False, False, False, False, False, False, False, False, False, False, False, False, False, False, False, False, False, False, False, False, False]",,Editto di Sofia,diktat bulgaro,censura politica,Questo è un editto bulgaro.,"[False, False, False, True, True]",ordine,,est-europeo,ordine est-europeo
testa di legno,""" o anche "" Il sindaco invisibile di Firenze "" o "" Renzie , la nuova testa di legno della finanza italiana , da De Benedetti agli Agnelli "" .","[False, False, False, False, False, False, False, False, False, False, False, False, False, False, False, False, True, True, True, False, False, False, False, False, False, False, False, False, False, False]",Comprano il marchio lasciando il vecchio gestore come testa di legno o inserendo un familiare fidato per schermare la propriet  .,"[False, False, False, False, False, False, False, False, True, True, True, False, False, False, False, False, False, False, False, False, False, False]","Da una parte della testa c ' era una treccina gialla , ma al posto dell ' altra treccina c ' era un posto vuoto , come se i capelli fossero stati strappati dalla testa di legno .","[False, False, False, False, False, False, False, False, False, False, False, False, False, False, False, False, False, False, False, False, False, False, False, False, False, False, False, False, False, False, False, False, False, False, True, True, True, False]",,prestanome,figura di facciata,persona ignorante,Questa è una testa di legno.,"[False, False, False, True, True, True]",cranio,di,legname,cranio di legname
anno accademico,Sono solo alcune delle novità dell' anno accademico 2007-2008 dell'Università degli adulti della Media Vallesina.,"[False, False, False, False, False, False, True, True, False, False, False, False, False, False, False]","All'alba del nuovo anno accademico riprendono le attività curricolari e non: nei collegi, teatro di eventi che ampliano e incrementano l'offerta formativa, i percorsi di approfondimento prendono il via con due incontri al collegio Augustinianum.","[False, False, False, True, True, False, False, False, False, False, False, False, False, False, False, False, False, False, False, False, False, False, False, False, False, False, False, False, False, False, False, False, False, False, False]",Il modello con i suoi allegati dovrà essere presentato nel periodo compreso tra la scadenza della prima rata di tasse per l'iscrizione all' anno accademico e il 20 dicembre.,"[False, False, False, False, False, False, False, False, False, False, False, False, False, False, False, False, False, False, False, False, False, False, False, True, True, False, False, False, False]",,periodo universitario,sessione di studi,ciclo d'istruzione superiore,Questo è un anno accademico.,"[False, False, False, True, True]",annualità,,universitaria,annualità universitaria
ore piccole,"Io soffro come un cane la domenica mattina , a messa , quando vedo nel coro i giovani cantori , e i primi banchi gremiti di ragazzi che animano la liturgia , mentre i miei due dormono ancora perché hanno fatto le ore piccole .","[False, False, False, False, False, False, False, False, False, False, False, False, False, False, False, False, False, False, False, False, False, False, False, False, False, False, False, False, False, False, False, False, False, False, False, False, False, False, False, False, False, False, True, True, False]",Dall ' 8 Maggio 99 sarà possibile migrare da qualsiasi tariffa prepagata attuale a TIM MENÙ gratuitamente TIM ha dichiarato che la tariffa notturna ( ore piccole ) è stata eliminata in quanto solo il 4 % dei clienti usa il cellulare nelle ore notturne .,"[False, False, False, False, False, False, False, False, False, False, False, False, False, False, False, False, False, False, False, False, False, False, False, False, False, True, True, False, False, False, False, False, False, False, False, False, False, False, False, False, False, False, False, False, False, False]","La guerra non sembra aver nemmeno sfiorato questo sito , che continua a presentare come sempre gli eventi culturali della capitale e a svolgere il suo ruolo di guida turistica , tra orchestrine jazz e caffè dove fare le ore piccole .","[False, False, False, False, False, False, False, False, False, False, False, False, False, False, False, False, False, False, False, False, False, False, False, False, False, False, False, False, False, False, False, False, False, False, False, False, False, False, False, True, True, False]",,dormire poco,ore notturne,veglia prolungata,Queste sono ore piccole.,"[False, False, True, True]",tempi,,minuscoli,tempi minuscoli
sogni d'oro,Dormi bene e sogni d ' oro .,"[False, False, False, True, False, False, True, False]",Amici e parenti fanno la fila per augurare sogni d'oro al piccolino .,"[False, False, False, False, False, False, False, False, True, True, False, False, False]","Con tutto il rispetto , e cavando un mezzo sorriso dalle disgrazie , possiamo dire che Isi Kostner e Morena Gallizio , dopo tanti sogni d'oro , hanno vinto due medaglie di latta .","[False, False, False, False, False, False, False, False, False, False, False, False, False, False, False, False, False, False, False, False, False, False, False, False, True, True, False, False, False, False, False, False, False, False]",,buonanotte,sonno sereno,riposo tranquillo,Questo è un sogni d'oro.,"[False, False, False, True, True]",sonni,di,metallo prezioso,sonni di metallo prezioso
passo carrabile,"È altresì importante specificare il tipo di infrazione, ad esempio se l'auto era parcheggiata in corrispondenza o in prossimità di un passaggio a livello, oppure allo sbocco di un passo carrabile , oppure nella corsia o carreggiata riservata ai mezzi pubblici, ecc.","[False, False, False, False, False, False, False, False, False, False, False, False, False, False, False, False, False, False, False, False, False, False, False, False, False, False, False, False, False, True, True, False, False, False, False, False, False, False, False, False, False, False]",Il titolare dell'autorizzazione è tenuto ad esporre il suddetto segnale con l'indicazione del numero di passo carrabile risultante dal provvedimento.,"[False, False, False, False, False, False, False, False, False, False, False, False, False, False, False, True, True, False, False, False]",Per costruire un passo carrabile bisogna rivolgersi al Servizio Strade.,"[False, False, False, True, True, False, False, False, False, False]",,accesso veicolare,divieto di sosta,entrata per auto,Questo è un passo carrabile.,"[False, False, False, True, True]",andatura,,viabile,andatura viabile
eminenza grigia,"Era un fine diplomatico , un uomo dall ' intelligenza fredda e acuta , che pian piano , da semplice consigliere del re , si era trasformato in una vera e propria eminenza grigia del regno .","[False, False, False, False, False, False, False, False, False, False, False, False, False, False, False, False, False, False, False, False, False, False, False, False, False, False, False, False, False, False, False, False, True, True, False, False, False]","È poi da valutare nel Pd l ' affermazione dei bassoliniani : Marciano , Gabriele , Amato , Cortese e D ' Amelio dimostrano che l ' ex governatore è ancora l ' eminenza grigia del Pd campano .","[False, False, False, False, False, False, False, False, False, False, False, False, False, False, False, False, False, False, False, False, False, False, False, False, False, False, False, False, False, False, False, False, False, True, True, False, False, False, False]","So tutto » , commenta il segretario Pierluigi Bersani , replicando a Favia che aveva detto chei leader nazionali non capivano che dietro Grillo c ' era l ' eminenza grigia .","[False, False, False, False, False, False, False, False, False, False, False, False, False, False, False, False, False, False, False, False, False, False, False, False, False, False, False, False, False, True, True, False]",,consigliere occulto,potere dietro le quinte,persona influente,Questa è una eminenza grigia.,"[False, False, False, True, True]",eccellenza,,cinerea,eccellenza cinerea
pezzo forte,Uno è il pezzo forte dell ' accusa che dimostrerebbe gli intensi rapporti di amicizia fra Contrada e Cassina .,"[False, False, False, True, True, False, False, False, False, False, False, False, False, False, False, False, False, False, False, False]","Così può capitare che il calorifero , un tempo occultato con mille stratagemmi , si trasformi nel pezzo forte del salotto di casa , o che venga utilizzato addirittura come pannello decorativo .","[False, False, False, False, False, False, False, False, False, False, False, False, False, False, False, False, False, True, True, False, False, False, False, False, False, False, False, False, False, False, False, False, False]","Il "" pezzo forte "" è il lavandino disegnato da Philippe Starck , che ricorda le toilette di un tempo : una semplice bacinella posata su un piano , entrambi in ceramica bianca , sostenuti da piedi in metallo cromato ( Duravit , L .","[False, False, True, True, False, False, False, False, False, False, False, False, False, False, False, False, False, False, False, False, False, False, False, False, False, False, False, False, False, False, False, False, False, False, False, False, False, False, False, False, False, False, False, False, False]",,punto di forza,clou,specialità,Questo è un pezzo forte.,"[False, False, False, True, True]",frammento,,robusto,frammento robusto
capro espiatorio,"Molto probabilmente il Gherardi è vittima dei fascisti , il suo caso deve aver terrorizzato il vostro Consiglio , che avrà ritenuto necessario offrire un capro espiatorio al Dio del giorno .","[False, False, False, False, False, False, False, False, False, False, False, False, False, False, False, False, False, False, False, False, False, False, False, False, False, True, True, False, False, False, False, False]","Questa confessione era pronunciata mentre Aaronne poneva le sue mani sulla testa di un capro , chiamato capro espiatorio .","[False, False, False, False, False, False, False, False, False, False, False, False, False, False, False, False, False, True, True, False]",È ingiusto usare un gruppo di adolescenti curiosi come capro espiatorio per le pratiche illecite condotte dalle imprese stesse .,"[False, False, False, False, False, False, False, False, False, True, True, False, False, False, False, False, False, False, False, False]",,vittima sacrificale,colpevole di comodo,bersaglio,Questo è un capro espiatorio.,"[False, False, False, True, True]",becco,,scontatore,becco scontatore
barca di soldi,"E perché io devo dare allo stato una barca di soldi che automaticamente mi vengono detratti dalla busta paga , e devo pagare settantamilalire alla settimana per le mie pilloline fascia C ?","[False, False, False, False, False, False, False, False, True, True, True, False, False, False, False, False, False, False, False, False, False, False, False, False, False, False, False, False, False, False, False, False, False]",A Padova la giunta sx di Zanonato ha speso una barca di soldi ( dei contribuenti ) per istallare dei varchi elettronici al centro storico .,"[False, False, False, False, False, False, False, False, False, False, True, True, True, False, False, False, False, False, False, False, False, False, False, False, False, False]","Continuerà ad avere il suo TG personale, Continuerà a guadagnare una barca di soldi e ... Tutte le multe e le penali le paga lo Stato","[False, False, False, False, False, False, False, False, False, False, False, True, True, True, False, False, False, False, False, False, False, False, False, False, False, False]",,fortuna economica,mucchio di denaro,patrimonio ingente,Questa è una barca di soldi.,"[False, False, False, True, True, True]",imbarcazione,di,denaro,imbarcazione di denaro
chiodo fisso,"Lei ha detto più volte , in questi ultimi mesi , che « i cambiamenti di cui ha bisogno la scuola italiana debbono diventare il chiodo fisso del governo » .","[False, False, False, False, False, False, False, False, False, False, False, False, False, False, False, False, False, False, False, False, False, False, False, False, False, True, True, False, False, False, False]","A questa cura , a questa attenzione per il funzionamento e per i risultati del nostro nuovo sistema di formazione e istruzione intendevo riferirmi , affermando che i cambiamenti di cui ha bisogno la scuola italiana debbono diventare un chiodo fisso per Governo e Parlamento .","[False, False, False, False, False, False, False, False, False, False, False, False, False, False, False, False, False, False, False, False, False, False, False, False, False, False, False, False, False, False, False, False, False, False, False, False, False, False, False, True, True, False, False, False, False, False]","Varianti del chiodo fisso sono il sesso solo fantasticato , più o meno associato a riti guardoni , esibizionistici , via via degenerando .","[False, False, True, True, False, False, False, False, False, False, False, False, False, False, False, False, False, False, False, False, False, False, False, False]",,ossessione,idea ricorrente,monomania,Questo è un chiodo fisso.,"[False, False, False, True, True]",bulletta,,immobile,bulletta immobile
strada statale,"L'Idrovora Santa Margerita si raggiunge dal Veneziano percorrendo la strada statale 309 Romea, in direzione di Chioggia-Ravenna.","[False, False, False, False, False, False, False, False, False, True, True, False, False, False, False, False, False]",Sarebbe stato raggiunto un accordo tra Anas ed Rfi sui lavori da effettuare lungo la strada statale .,"[False, False, False, False, False, False, False, False, False, False, False, False, False, False, False, True, True, False]",La corsia si innesterà infine sulla strada statale della Valsugana attraverso una pista di accelerazione lunga circa 70 metri.,"[False, False, False, False, False, False, True, True, False, False, False, False, False, False, False, False, False, False, False]",,arteria stradale,collegamento nazionale,viabilità ordinaria,Questa è una strada statale.,"[False, False, False, True, True]",carreggiata,,nazionale,carreggiata nazionale
notte dei cristalli,"Gli echi e le scene della "" Notte dei cristalli "" ( 9 novembre 1938 ) , quando i nazisti incendiarono le sinagoghe e compirono atti di terrorismo contro gli ebrei , lo accompagnavano tormentandolo .","[False, False, False, False, False, False, False, True, True, True, False, False, False, False, False, False, False, False, False, False, False, False, False, False, False, False, False, False, False, False, False, False, False, False, False, False]","Risultato : anche gli ebrei si chiudono nel branco , vivono la sindrome del complotto globale , parlano già di emigrare o rievocano la Notte dei cristalli , come fosse tornato il nazismo .","[False, False, False, False, False, False, False, False, False, False, False, False, False, False, False, False, False, False, False, False, False, False, False, False, True, True, True, False, False, False, False, False, False, False]","Se a Berlino vi fu la Notte dei Cristalli con la distruzione dei negozi degli ebrei , ad Atene , notte dopo notte , non si fa distinzione tra le diverse etnie di immigrati .","[False, False, False, False, False, False, True, True, True, False, False, False, False, False, False, False, False, False, False, False, False, False, False, False, False, False, False, False, False, False, False, False, False, False, False]",,pogrom nazista,evento del 1938,strage antisemita,Questa è una notte dei cristalli.,"[False, False, False, True, True, True]",buio,dei,vetri,buio dei vetri
