NC,sentence_nat_1,tag_sentence_nat_1,sentence_nat_2,tag_sentence_nat_2,sentence_nat_3,tag_sentence_nat_3,comp_score,gold_syn_1,gold_syn_2,gold_syn_3,sentence_neut,tag_sentence_neut,word_1,word_x,word_2,wordsyn
ancora di salvezza,"Era in fondo l ' indicazione venuta dal congresso medico di Venezia , quello che aveva individuato in questa singolare proposta l ' estrema ancora di salvezza di uno sport che , comunque , era stato pesantemente condannato .","[False, False, False, False, False, False, False, False, False, False, False, False, False, False, False, False, False, False, False, False, False, False, False, False, True, True, True, False, False, False, False, False, False, False, False, False, False, False, False]","L ' incertezza su quanto stesse accadendo in un ospedale poco distante era stata inizialmente insopportabile ; poi essa era divenuta , col trascorrer dei minuti , un ' ancora di salvezza a cui aggrapparsi , sperando quasi che nessuna nuova potesse giungere a spezzarne la sospensione .","[False, False, False, False, False, False, False, False, False, False, False, False, False, False, False, False, False, False, False, False, False, False, False, False, False, False, False, False, False, True, True, True, False, False, False, False, False, False, False, False, False, False, False, False, False, False, False, False]",""" "" Perché potrebbe simboleggiare l ' ancora di salvezza che ognuno di noi vede , o ha bisogno di vedere , in qualcun altro ... "" "" Ma lui è solo come un cane per tutto il tempo !","[False, False, False, False, False, False, False, True, True, True, False, False, False, False, False, False, False, False, False, False, False, False, False, False, False, False, False, False, False, False, False, False, False, False, False, False, False, False, False, False]",,ultimo rimedio,ultima speranza,appiglio finale,Questa è una ancora di salvezza.,"[False, False, False, True, True, True]",ormeggio,di,soccorso,ormeggio di soccorso
oro colato,Il mondo di Atlantis Di seguito una piccola mappa ( non prendetela per oro colato ) delle lande di Atlantis .,"[False, False, False, False, False, False, False, False, False, False, False, False, False, True, True, False, False, False, False, False, False]","> Riuscite ad essere offensivi e prepotenti come sempre , parlate di tutto e di tutti senza fare un pò di autocritica e senza mettere un pò di ironia , come se tutto quello che dite fosse oro colato .","[False, False, False, False, False, False, False, False, False, False, False, False, False, False, False, False, False, False, False, False, False, False, False, False, False, False, False, False, False, False, False, False, False, False, False, False, False, True, True, False]","Prima di accettare come oro colato , quello che ci viene dichiarato o proposto , può rivelarsi molto utile ottenere mediante Alexa informazioni sulla proprietà del sito .","[False, False, False, False, True, True, False, False, False, False, False, False, False, False, False, False, False, False, False, False, False, False, False, False, False, False, False, False]",,verità assoluta,certezza indiscutibile,conoscenza insindacabile,Questo è un oro colato.,"[False, False, False, True, True]",metallo,,versato,metallo versato
teatro di prosa,Sarà ricca di novità la settima edizione del cartellone estivo di teatro di prosa che avrà come quinte e palco la splendida cornice della Villa Tamborino a Maglie. ,"[False, False, False, False, False, False, False, False, False, False, False, True, True, True, False, False, False, False, False, False, False, False, False, False, False, False, False, False]"," Alla rappresentante DS si è chiesto di confermare questa centralità e collegare a questa dimensione di ""alta"" politica, le fondamentali questioni di riforma legislativa e definizione di competenze che riguardano il teatro di prosa .","[False, False, False, False, False, False, False, False, False, False, False, False, False, False, False, False, False, False, False, False, False, False, False, False, False, False, False, False, False, False, False, True, True, True, False]","Si trattava insomma di realizzare quasi un musical, che fosse anche teatro di prosa , utilizzando gl'illuminati testi e le musiche di Bennato.","[False, False, False, False, False, False, False, False, False, False, False, True, True, True, False, False, False, False, False, False, False, False, False]",,drammaturgia,teatro parlato,rappresentazione teatrale,Questo è un teatro di prosa.,"[False, False, False, True, True, True]",spettacolo,di,narrazione,spettacolo di narrazione
teorema accusatorio,"Vede , mi è bastata un ' occhiata per respingere il castello delle accuse : il suo teorema accusatorio vacilla ... Non c ' è il più pallido indizio .","[False, False, False, False, False, False, False, False, False, False, False, False, False, False, False, False, False, True, True, False, False, False, False, False, False, False, False, False, False, False]","Secondo il teorema accusatorio del pubblico ministero Vittorio Masia , Giacovelli era solito prestare denaro a commercianti in difficoltà rilasciando cambiali e assegni post - datati con importi nettamente maggiorati .","[False, False, True, True, False, False, False, False, False, False, False, False, False, False, False, False, False, False, False, False, False, False, False, False, False, False, False, False, False, False, False]","Nell ' introduzione al dispositivo , i giudici dell ' ottava sezione penale del Tribunale di Milano hanno sottolineato l ' attendibilità della consulenza tecnica sul quale il pubblico ministero Riccardo Targetti ha imperniato il suo teorema accusatorio , redatta dal commercialista Gian Gaetano Bellavia .","[False, False, False, False, False, False, False, False, False, False, False, False, False, False, False, False, False, False, False, False, False, False, False, False, False, False, False, False, False, False, False, False, False, False, False, False, True, True, False, False, False, False, False, False, False, False]",,tesi della procura,ipotesi d'accusa,impianto accusatorio,Questo è un teorema accusatorio.,"[False, False, False, True, True]",dimostrazione,,incolpante,dimostrazione incolpante
colpo di coda,"Tornando alla notizia , mi chiedo questo è l ' ultimo colpo di coda della "" vecchia concertazione "" o il primo della "" nuova concertazione "" ?","[False, False, False, False, False, False, False, False, False, False, False, True, True, True, False, False, False, False, False, False, False, False, False, False, False, False, False, False]",Non manca il colpo di coda finale che sembra per un attimo annullare ( non come nel libro dove ci si spinge molto più in là ) ogni distanza di sicurezza tra guardia e ladro : efficace e spettacolare .,"[False, False, False, True, True, True, False, False, False, False, False, False, False, False, False, False, False, False, False, False, False, False, False, False, False, False, False, False, False, False, False, False, False, False, False, False, False, False, False, False]","Ciò a cui la Chiesa cattolica romana ha dato avvio con il pontificato di Giovanni Paolo II non può essere scambiato per il colpo di coda di un ' istituzione superata dai tempi , sopravvissuta a se stessa , abbarbicata in una guerra di difesa .","[False, False, False, False, False, False, False, False, False, False, False, False, False, False, False, False, False, False, False, False, False, False, False, True, True, True, False, False, False, False, False, False, False, False, False, False, False, False, False, False, False, False, False, False, False, False]",,reazione finale,ultimo scatto,ritorno di fiamma,Questo è un colpo di coda.,"[False, False, False, True, True, True]",urto,di,appendice,urto di appendice
convitato di pietra,"Ma allora si credeva ancora che il convitato di pietra , l ' ostacolo al giro di boa dell ' Unione in Rai , l ' algido Angelo Maria Petroni , consigliere nominato dall ' azionista , il ministero dell ' Economia , sarebbe stato rimosso .","[False, False, False, False, False, False, False, True, True, True, False, False, False, False, False, False, False, False, False, False, False, False, False, False, False, False, False, False, False, False, False, False, False, False, False, False, False, False, False, False, False, False, False, False, False, False, False]","Finalmente a Rimini è arrivato anche il "" convitato di Pietra "" : Sergio Marchionne , l ' ad della Fiat .","[False, False, False, False, False, False, False, False, True, True, True, False, False, False, False, False, False, False, False, False, False, False]",Ma il partito di Malpensa ora teme di perdere la sfida * MILANO - Il convitato di pietra continua ad abitare a Malpensa .,"[False, False, False, False, False, False, False, False, False, False, False, False, False, False, False, True, True, True, False, False, False, False, False, False]",,ospite inatteso,presenza inquietante,figura silenziosa ma influente,Questo è un convitato di pietra.,"[False, False, False, True, True, True]",commensale,di,roccia,ospite di roccia
tessera sanitaria,In un prossimo futuro sarà possibile attivare la propria tessera sanitaria anche presso l'ufficio relazioni con il pubblico del Comune.,"[False, False, False, False, False, False, False, False, False, True, True, False, False, False, False, False, False, False, False, False]","Il pagamento dovrà avvenire dopo aver presentato all'Ufficio Servizi Cimiteriali, apposita istanza per il pagamento del canone, allegando fotocopia del documento di riconoscimento in corso di validità e della tessera sanitaria .","[False, False, False, False, False, False, False, False, False, False, False, False, False, False, False, False, False, False, False, False, False, False, False, False, False, False, False, False, False, True, True, False]","Appurata la falsità delle patenti e della tessera sanitaria esibita da uno dei due uomini, gli accertamenti dattiloscopici hanno poi portato alla scoperta delle loro reali identità.","[False, False, False, False, False, False, False, True, True, False, False, False, False, False, False, False, False, False, False, False, False, False, False, False, False, False, False]",,tesserino,codice fiscale plastificato,documento per cure mediche,Questa è una tessera sanitaria.,"[False, False, False, True, True]",carta,,medica,carta medica
mina vagante,"Se poi la ragazzina fosse stata sua nipote , e se le private fantasie del personaggio non preludessero affatto a pratiche criminali , pazienza , meglio un innocente di più in galera che una mina vagante pericolosa per la società .","[False, False, False, False, False, False, False, False, False, False, False, False, False, False, False, False, False, False, False, False, False, False, False, False, False, False, False, False, False, False, False, False, False, False, True, True, False, False, False, False, False]","Anche chi , come il sottoscritto , tende a reagire con fastidio ai resoconti giornalistici sulla diffusione di virus via Rete deve ammettere che lo scaricamento selvaggio è una vera e propria mina vagante per la sicurezza su Internet .","[False, False, False, False, False, False, False, False, False, False, False, False, False, False, False, False, False, False, False, False, False, False, False, False, False, False, False, False, False, False, False, False, True, True, False, False, False, False, False, False]",Earth Tuner 1.3 beta Web Stereo 3.0 DRS 2006 1.3 Y2K Il baco del millennio : una mina vagante o una bufala ?,"[False, False, False, False, False, False, False, False, False, False, False, False, False, False, False, False, False, True, True, False, False, False, False]",,pericolo imprevedibile,elemento instabile,rischio latente,Questa è una mina vagante.,"[False, False, False, True, True]",ordigno,,errante,ordigno errante
mare aperto,Quella per il regatare in mare aperto è una passione che torna a prendere piede nella vela sportiva italiana.,"[False, False, False, False, False, True, True, False, False, False, False, False, False, False, False, False, False, False, False]","E' possibile vivere un'esperienza unica accedendo alla grotta dal mare aperto , tramite un suggestivo tunnel.","[False, False, False, False, False, False, False, False, False, True, True, False, False, False, False, False]","Riesco a convincere il proprietario ad effettuare il rilascio non come voleva fare lui in mare aperto e di giorno, ma in spiaggia e di sera dopo il tramonto.","[False, False, False, False, False, False, False, False, False, False, False, False, False, False, False, True, True, False, False, False, False, False, False, False, False, False, False, False, False]",,alto mare,acque internazionali,distesa marina,Questo è un mare aperto.,"[False, False, False, True, True]",acque,,spalancate,acque spalancate
vitello grasso,Mesi che Francesco Rutelli manda sorridenti messaggi di apertura a ogni figliol prodigo che all ' incubo delle vacche magre berlusconiane preferirebbe un vitello grasso prodiano .,"[False, False, False, False, False, False, False, False, False, False, False, False, False, False, False, False, False, False, False, False, False, False, False, True, True, False, False]","Portate il vitello grasso , ammazzatelo , mangiamo e facciamo festa , perché questo mio figlio era morto ed è tornato in vita , era perduto ed è stato ritrovato "" .","[False, False, True, True, False, False, False, False, False, False, False, False, False, False, False, False, False, False, False, False, False, False, False, False, False, False, False, False, False, False, False, False]","Il servo gli rispose : "" È tornato tuo fratello e il padre ha fatto ammazzare il vitello grasso , perché lo ha riavuto sano e salvo "" .","[False, False, False, False, False, False, False, False, False, False, False, False, False, False, False, False, False, True, True, False, False, False, False, False, False, False, False, False, False]",,grande festeggiamento,festa del ritorno,accoglienza sontuosa,Questo è un vitello grasso.,"[False, False, False, True, True]",bovino,,sovrappeso,bovino sovrappeso
mostro sacro,"Sordi interpreta e dirige "" Vacanze intelligenti "" , con il quale riesce persino ad ironizzare , con grande maestria , su un mostro sacro della cultura italiana : la Biennale d ' Arte di Venezia .","[False, False, False, False, False, False, False, False, False, False, False, False, False, False, False, False, False, False, False, False, False, False, False, True, True, False, False, False, False, False, False, False, False, False, False, False, False]","com Un altro "" mostro sacro "" della moda francese , Yves Saint Laurent , ha allestito un sito .","[False, False, False, False, True, True, False, False, False, False, False, False, False, False, False, False, False, False, False, False]","Anche perché ormai da tempo è diventato un ' icona , un mostro sacro , una sorta di parametro assoluto della grande recitazione .","[False, False, False, False, False, False, False, False, False, False, False, False, True, True, False, False, False, False, False, False, False, False, False, False]",,icona intoccabile,presenza ingombrante,grande personalità,Questo è un mostro sacro.,"[False, False, False, True, True]",creatura,,benedetta,creatura benedetta
botta di vita,"Traduzione fra le righe : Roma è una caotica capitale di simpatici casinari e per noi che viviamo tutto l ' anno in una civile normalità , questa botta di vita e di caos ci elettrizza , ma soltanto per qualche giorno .","[False, False, False, False, False, False, False, False, False, False, False, False, False, False, False, False, False, False, False, False, False, False, False, False, False, False, False, False, True, True, True, False, False, False, False, False, False, False, False, False, False, False, False]","1988 89 Nel periodo natalizio esce nelle sale il film "" Una botta di vita "" , diretto da Enrico Oldoini , sceneggiato e interpretato dallo stesso Sordi .","[False, False, False, False, False, False, False, False, False, False, False, False, True, True, True, False, False, False, False, False, False, False, False, False, False, False, False, False, False]","Se vuoi darti una botta di vita , non c ' è bisogno di scomodare avvocati e carte bollate , puoi farlo comunque , io l ' ho sempre fatto .","[False, False, False, False, True, True, True, False, False, False, False, False, False, False, False, False, False, False, False, False, False, False, False, False, False, False, False, False, False, False, False]",,momento di vitalità,scossa di energia,esperienza entusiasmante,Questa è una botta di vita.,"[False, False, False, True, True, True]",percosse,di,esistenza,percosse di esistenza
animale domestico,"Se vuoi trovare a Livorno un negozio che si occupi della cura e del benessere del tuo animale domestico , Sheva propone un vasto assortimento di prodotti per il tuo animale, a prezzi veramente competitivi, comodamente in città.","[False, False, False, False, False, False, False, False, False, False, False, False, False, False, False, False, False, True, True, False, False, False, False, False, False, False, False, False, False, False, False, False, False, False, False, False, False, False]","La presenza di un cane, di un gatto e, più in generale, di un animale domestico in casa non è incompatibile con quella di un bambino piccolo ma anzi può rappresentare uno stimolo importante per la sua crescita psicologica ed affettiva.","[False, False, False, False, False, False, False, False, False, False, False, False, False, False, True, True, False, False, False, False, False, False, False, False, False, False, False, False, False, False, False, False, False, False, False, False, False, False, False, False, False]",Anche il timido animale domestico non sarà mai spaventato dalla fontana di acqua potabile del gatto.,"[False, False, False, True, True, False, False, False, False, False, False, False, False, False, False, False]",,cucciolo,animale da compagnia,animale di casa,Questo è un animale domestico.,"[False, False, False, True, True]",bestia,,casalinga,bestia casalinga
cane bastonato,"Infine , la polizia svolge i suoi compiti nell ' indifferenza generale : il poliziotto ( che noi conosciamo dall ' interno grazie alla voce narrante ) si sente come un cane bastonato .","[False, False, False, False, False, False, False, False, False, False, False, False, False, False, False, False, False, False, False, False, False, False, False, False, False, False, False, False, False, False, False, True, True, False]","All ' inizio m ' usciva una voce da cane bastonato che certo non favoriva il contatto , ma dopo un po ' mi ripresi , perché è simpatica e umana questa gente delle osterie e si diventa subito amici .","[False, False, False, False, False, False, False, False, False, True, True, False, False, False, False, False, False, False, False, False, False, False, False, False, False, False, False, False, False, False, False, False, False, False, False, False, False, False, False, False, False]","Terminata la funzione , messer Rinaldo si rivolse al fido intendente , un omaccione che stava lì a capo chino come un cane bastonato : "" Chi l ' ha scoperta ?","[False, False, False, False, False, False, False, False, False, False, False, False, False, False, False, False, False, False, False, False, False, False, True, True, False, False, False, False, False, False, False, False]",,persona umiliata,persona rimproverata,individuo sottomesso,Questo è un cane bastonato.,"[False, False, False, True, True]",segugio,,percosso,segugio percosso
anatra zoppa,"Nell ' ipotesi che viene definita « anatra zoppa » , al centrodestra andrebbero circa 46 seggi più quello che scatta al candidato Cuffaro , totale 47 .","[False, False, False, False, False, False, False, True, True, False, False, False, False, False, False, False, False, False, False, False, False, False, False, False, False, False, False, False]","Non è un ' anatra zoppa , Juncker , o almeno non ancora : « Non lo è se viene in parlamento e risponde in maniera convincente ad accuse gravissime » , dice ad esempio all ' Espresso l ' eurodeputato Pd David Sassoli .","[False, False, False, False, True, True, False, False, False, False, False, False, False, False, False, False, False, False, False, False, False, False, False, False, False, False, False, False, False, False, False, False, False, False, False, False, False, False, False, False, False, False, False, False, False]","Anatra zoppa Juncker resterà probabilmente al suo posto per non turbare , per ora , gli equilibri faticosamente raggiunti nella spartizione del potere continentale .","[True, True, False, False, False, False, False, False, False, False, False, False, False, False, False, False, False, False, False, False, False, False, False, False, False]",,politico incapace,governo indebolito,figura politica in declino,Questa è una anatra zoppa.,"[False, False, False, True, True]",pennuto,,claudicante,pennuto claudicante
pomo della discordia,"Venerato da Cragnotti e vituperato dallo stesso , Lei è diventato a Roma il pomo della discordia : c ' è chi ha raccolto firme per trattenerla e chi ha agitato striscioni per cacciarla .","[False, False, False, False, False, False, False, False, False, False, False, False, False, False, True, True, True, False, False, False, False, False, False, False, False, False, False, False, False, False, False, False, False, False, False]",""" È proprio il famoso articolo sui "" permessini "" , il "" pomo della discordia "" della Circolare Bazzocchi .","[False, False, False, False, False, False, False, False, False, False, False, False, False, True, True, True, False, False, False, False, False]","Milton "" scivola "" su una banana e Costanzo lo caccia da Buona Domenica ( Partenopress ) - La banana non è solo "" l ' unico frutto dell ' amor "" , ma anche un valido pomo della discordia .","[False, False, False, False, False, False, False, False, False, False, False, False, False, False, False, False, False, False, False, False, False, False, False, False, False, False, False, False, False, False, False, False, False, False, False, False, False, True, True, True, False]",,motivo di lite,origine del dissenso,elemento controverso,Questo è un pomo della discordia.,"[False, False, False, True, True, True]",mela,della,divergenza,mela della divergenza
braccino corto,""" È quello che succede ad avere il braccino corto , Mimmo "" lo punzecchia la matrona che forse gli compete .","[False, False, False, False, False, False, False, False, True, True, False, False, False, False, False, False, False, False, False, False, False, False]","In questo , anzi , Chruscev fu persino più spendaccione di Stalin , che in verità in fatto di ricompense aveva un pó il braccino corto .","[False, False, False, False, False, False, False, False, False, False, False, False, False, False, False, False, False, False, False, False, False, False, False, False, True, True, False]","Altro che braccino corto , le mani della defunta dovevano essere attaccate direttamente sotto la spalla .","[False, False, True, True, False, False, False, False, False, False, False, False, False, False, False, False, False]",,avarizia,spilorceria,tirchieria,Questo è un braccino corto.,"[False, False, False, True, True]",arto,,breve,arto breve
man forte,"Possibilmente al capolinea , in modo da farci ascoltare da qualche decina di altri utenti che possano darci man forte .","[False, False, False, False, False, False, False, False, False, False, False, False, False, False, False, False, False, False, True, True, False]",", hanno infatti capito le potenzialità dei tre milioni di computer collegati in Rete ed hanno calcolato che se solo cinquantamila PC daranno loro man forte , la potenza di calcolo complessiva raggiungerà quella dei maggiori progetti che fanno invece uso di sofisticati e costosi supercalcolatori .","[False, False, False, False, False, False, False, False, False, False, False, False, False, False, False, False, False, False, False, False, False, False, False, False, True, True, False, False, False, False, False, False, False, False, False, False, False, False, False, False, False, False, False, False, False, False, False]","Perotti corre subito ai ripari e inserisce un ' altra punta , Tavano , a dare man forte a Rocchi .","[False, False, False, False, False, False, False, False, False, False, False, False, False, False, False, False, True, True, False, False, False]",,aiuto,sostegno,supporto,Questa è una man forte.,"[False, False, False, True, True]",arto,,robusto,arto robusto
